{"execution_id": "4f73bd370d3b4039af6a376c649d785a", "timestamp": "2025-11-28T01:33:32.137525", "user_id": "L0092LLGP", "llm": "gpt-5-chat", "prompt_type": "context_multistep_english", "original_deck": ["Mega Knight", "Spear Goblins", "Bats", "Skeletons"], "deleted_cards": ["Bandit", "Skeleton Barrel", "Zap", "Firecracker"], "raw_response": "```json\n{\n  \"selection\": [\"Miner\", \"Inferno Dragon\", \"Poison\", \"Zap\"],\n  \"detail\": [\n    {\n      \"card\": \"Miner\",\n      \"elixir_cost\": \"3\",\n      \"role\": \"win condition / chip damage\",\n      \"synergiesWith\": [\"Mega Knight\", \"Bats\", \"Spear Goblins\", \"Skeletons\"],\n      \"coversWeakness\": [\"lack of direct win condition\", \"pressure potential\"],\n      \"elixirImpact\": {\"before\": 2.75, \"after\": 3.625}\n    },\n    {\n      \"card\": \"Inferno Dragon\",\n      \"elixir_cost\": \"4\",\n      \"role\": \"tank killer / air defense\",\n      \"synergiesWith\": [\"Mega Knight\", \"Bats\", \"Spear Goblins\"],\n      \"coversWeakness\": [\"anti-air\", \"heavy tank counter\"],\n      \"elixirImpact\": {\"before\": 3.625, \"after\": 3.875}\n    },\n    {\n      \"card\": \"Poison\",\n      \"elixir_cost\": \"4\",\n      \"role\": \"area control / spell\",\n      \"synergiesWith\": [\"Miner\", \"Mega Knight\"],\n      \"coversWeakness\": [\"swarm control\", \"defensive spell\"],\n      \"elixirImpact\": {\"before\": 3.875, \"after\": 4.125}\n    },\n    {\n      \"card\": \"Zap\",\n      \"elixir_cost\": \"2\",\n      \"role\": \"small spell / reset\",\n      \"synergiesWith\": [\"Inferno Dragon\", \"Bats\", \"Spear Goblins\"],\n      \"coversWeakness\": [\"small swarm removal\", \"reset Inferno / Sparky\"],\n      \"elixirImpact\": {\"before\": 4.125, \"after\": 3.875}\n    }\n  ],\n  \"summary\": \"This deck forms a Mega Knight Miner control archetype with strong counter-push potential, solid air defense, and dual spells for versatility.\",\n  \"n\": 4,\n  \"chainOfThought\": {\n    \"initialSelection\": {\n      \"archetypeIdentified\": \"Mega Knight Miner Control\",\n      \"roleGaps\": [\"win condition\", \"anti-air\", \"area spell\", \"reset spell\"],\n      \"reasoning\": \"Mega Knight provides splash tank defense and counter-push. Skeletons and Spear Goblins offer cheap cycle and distraction, while Bats give air coverage. The deck lacks a win condition and reliable spells. Miner adds chip damage and synergy with Poison for control. Inferno Dragon covers tanks and air threats. Zap provides a cheap reset and swarm clear.\",\n      \"initialCards\": [\"Miner\", \"Inferno Dragon\", \"Poison\", \"Zap\"],\n      \"elixirAnalysis\": \"Average elixir rises from 2.75 to ~3.9, balanced for a control deck with Mega Knight as heavy anchor.\"\n    },\n    \"review\": {\n      \"verificationResults\": {\n        \"allCardsAvailable\": true,\n        \"noDuplicates\": true,\n        \"correctCount\": true,\n        \"noRedundancies\": true,\n        \"rolesCovered\": true,\n        \"elixirReasonable\": true,\n        \"synergyCheck\": true\n      },\n      \"issuesFound\": [],\n      \"reviewNotes\": \"All selected cards are available, unique, and synergize well. The deck covers all roles: win condition (Miner), heavy defense (Mega Knight), air/tank control (Inferno Dragon), cycle units (Skeletons, Spear Goblins, Bats), and dual spells (Poison + Zap). Elixir curve is balanced.\"\n    },\n    \"refinement\": {\n      \"changesMade\": false,\n      \"cardsReplaced\": [],\n      \"finalReasoning\": \"No issues found. The selection is optimal for a Mega Knight Miner control deck, offering strong defense, counter-push potential, and balanced elixir curve.\",\n      \"confidence\": \"high\"\n    }\n  }\n}\n```", "parsed_selection": {"selection": ["Miner", "Inferno Dragon", "Poison", "Zap"], "detail": [{"card": "Miner", "elixir_cost": "3", "role": "win condition / chip damage", "synergiesWith": ["Mega Knight", "Bats", "Spear Goblins", "Skeletons"], "coversWeakness": ["lack of direct win condition", "pressure potential"], "elixirImpact": {"before": 2.75, "after": 3.625}}, {"card": "Inferno Dragon", "elixir_cost": "4", "role": "tank killer / air defense", "synergiesWith": ["Mega Knight", "Bats", "Spear Goblins"], "coversWeakness": ["anti-air", "heavy tank counter"], "elixirImpact": {"before": 3.625, "after": 3.875}}, {"card": "Poison", "elixir_cost": "4", "role": "area control / spell", "synergiesWith": ["Miner", "Mega Knight"], "coversWeakness": ["swarm control", "defensive spell"], "elixirImpact": {"before": 3.875, "after": 4.125}}, {"card": "Zap", "elixir_cost": "2", "role": "small spell / reset", "synergiesWith": ["Inferno Dragon", "Bats", "Spear Goblins"], "coversWeakness": ["small swarm removal", "reset Inferno / Sparky"], "elixirImpact": {"before": 4.125, "after": 3.875}}], "summary": "This deck forms a Mega Knight Miner control archetype with strong counter-push potential, solid air defense, and dual spells for versatility.", "n": 4, "chainOfThought": {"initialSelection": {"archetypeIdentified": "Mega Knight Miner Control", "roleGaps": ["win condition", "anti-air", "area spell", "reset spell"], "reasoning": "Mega Knight provides splash tank defense and counter-push. Skeletons and Spear Goblins offer cheap cycle and distraction, while Bats give air coverage. The deck lacks a win condition and reliable spells. Miner adds chip damage and synergy with Poison for control. Inferno Dragon covers tanks and air threats. Zap provides a cheap reset and swarm clear.", "initialCards": ["Miner", "Inferno Dragon", "Poison", "Zap"], "elixirAnalysis": "Average elixir rises from 2.75 to ~3.9, balanced for a control deck with Mega Knight as heavy anchor."}, "review": {"verificationResults": {"allCardsAvailable": true, "noDuplicates": true, "correctCount": true, "noRedundancies": true, "rolesCovered": true, "elixirReasonable": true, "synergyCheck": true}, "issuesFound": [], "reviewNotes": "All selected cards are available, unique, and synergize well. The deck covers all roles: win condition (Miner), heavy defense (Mega Knight), air/tank control (Inferno Dragon), cycle units (Skeletons, Spear Goblins, Bats), and dual spells (Poison + Zap). Elixir curve is balanced."}, "refinement": {"changesMade": false, "cardsReplaced": [], "finalReasoning": "No issues found. The selection is optimal for a Mega Knight Miner control deck, offering strong defense, counter-push potential, and balanced elixir curve.", "confidence": "high"}}}, "is_parsed": true, "error": null}
{"execution_id": "2b54aeb1470d44f2b6ee74aba92920cd", "timestamp": "2025-11-28T01:33:32.138642", "user_id": "VL0QCY9R8", "llm": "gpt-5-chat", "prompt_type": "context_multistep_english", "original_deck": ["Firecracker", "Bats", "Skeletons", "Skeleton Barrel"], "deleted_cards": ["Zap", "Mega Knight", "Bandit", "Spear Goblins"], "raw_response": "```json\n{\n  \"selection\": [\"Miner\", \"Mega Knight\", \"Inferno Dragon\", \"Zap\"],\n  \"detail\": [\n    {\n      \"card\": \"Miner\",\n      \"elixir_cost\": \"3\",\n      \"role\": \"win condition / chip damage\",\n      \"synergiesWith\": [\"Skeleton Barrel\", \"Bats\", \"Firecracker\"],\n      \"coversWeakness\": [\"lack of direct tower damage\", \"cycle pressure\"],\n      \"elixirImpact\": {\"before\": 2.5, \"after\": 3.25}\n    },\n    {\n      \"card\": \"Mega Knight\",\n      \"elixir_cost\": \"7\",\n      \"role\": \"tank / splash defense\",\n      \"synergiesWith\": [\"Bats\", \"Skeleton Barrel\", \"Firecracker\"],\n      \"coversWeakness\": [\"ground tank\", \"area control\"],\n      \"elixirImpact\": {\"before\": 3.25, \"after\": 3.75}\n    },\n    {\n      \"card\": \"Inferno Dragon\",\n      \"elixir_cost\": \"4\",\n      \"role\": \"tank killer / air defense\",\n      \"synergiesWith\": [\"Mega Knight\", \"Miner\", \"Firecracker\"],\n      \"coversWeakness\": [\"anti-tank\", \"air DPS\"],\n      \"elixirImpact\": {\"before\": 3.75, \"after\": 3.625}\n    },\n    {\n      \"card\": \"Zap\",\n      \"elixir_cost\": \"2\",\n      \"role\": \"small spell / reset\",\n      \"synergiesWith\": [\"Bats\", \"Skeleton Barrel\", \"Inferno Dragon\"],\n      \"coversWeakness\": [\"swarm control\", \"reset inferno / sparky\"],\n      \"elixirImpact\": {\"before\": 3.625, \"after\": 3.5}\n    }\n  ],\n  \"summary\": \"Final deck forms a Miner–Mega Knight bait-control archetype using Firecracker and Skeleton Barrel for pressure, supported by Bats and Skeletons for cycle and defense. Balanced elixir curve with strong synergy and dual win conditions.\",\n  \"n\": 4,\n  \"chainOfThought\": {\n    \"initialSelection\": {\n      \"archetypeIdentified\": \"Miner–Mega Knight bait/control cycle\",\n      \"roleGaps\": [\"win condition\", \"tank\", \"anti-tank/air\", \"small spell\"],\n      \"reasoning\": \"The selected cards (Firecracker, Bats, Skeletons, Skeleton Barrel) indicate a light bait/cycle core. To complete, Miner provides a reliable win condition and synergy with Barrel; Mega Knight adds tank and splash defense; Inferno Dragon covers heavy tanks and air; Zap offers cheap control and synergy with bait units.\",\n      \"initialCards\": [\"Miner\", \"Mega Knight\", \"Inferno Dragon\", \"Zap\"],\n      \"elixirAnalysis\": \"Average cost rises from ~2.5 to ~3.5, maintaining a mid-cycle balance suitable for Miner–Mega Knight control.\"\n    },\n    \"review\": {\n      \"verificationResults\": {\n        \"allCardsAvailable\": true,\n        \"noDuplicates\": true,\n        \"correctCount\": true,\n        \"noRedundancies\": true,\n        \"rolesCovered\": true,\n        \"elixirReasonable\": true,\n        \"synergyCheck\": true\n      },\n      \"issuesFound\": [],\n      \"reviewNotes\": \"All selected cards are available, unique, and synergistic. Roles are well distributed: Miner for win condition, Mega Knight for tank/splash, Inferno Dragon for anti-tank/air, Zap for control. Elixir curve is balanced.\"\n    },\n    \"refinement\": {\n      \"changesMade\": false,\n      \"cardsReplaced\": [],\n      \"finalReasoning\": \"No issues found; the selection optimally complements the existing bait/cycle core. The deck achieves strong synergy, defensive stability, and offensive versatility.\",\n      \"confidence\": \"high\"\n    }\n  }\n}\n```", "parsed_selection": {"selection": ["Miner", "Mega Knight", "Inferno Dragon", "Zap"], "detail": [{"card": "Miner", "elixir_cost": "3", "role": "win condition / chip damage", "synergiesWith": ["Skeleton Barrel", "Bats", "Firecracker"], "coversWeakness": ["lack of direct tower damage", "cycle pressure"], "elixirImpact": {"before": 2.5, "after": 3.25}}, {"card": "Mega Knight", "elixir_cost": "7", "role": "tank / splash defense", "synergiesWith": ["Bats", "Skeleton Barrel", "Firecracker"], "coversWeakness": ["ground tank", "area control"], "elixirImpact": {"before": 3.25, "after": 3.75}}, {"card": "Inferno Dragon", "elixir_cost": "4", "role": "tank killer / air defense", "synergiesWith": ["Mega Knight", "Miner", "Firecracker"], "coversWeakness": ["anti-tank", "air DPS"], "elixirImpact": {"before": 3.75, "after": 3.625}}, {"card": "Zap", "elixir_cost": "2", "role": "small spell / reset", "synergiesWith": ["Bats", "Skeleton Barrel", "Inferno Dragon"], "coversWeakness": ["swarm control", "reset inferno / sparky"], "elixirImpact": {"before": 3.625, "after": 3.5}}], "summary": "Final deck forms a Miner–Mega Knight bait-control archetype using Firecracker and Skeleton Barrel for pressure, supported by Bats and Skeletons for cycle and defense. Balanced elixir curve with strong synergy and dual win conditions.", "n": 4, "chainOfThought": {"initialSelection": {"archetypeIdentified": "Miner–Mega Knight bait/control cycle", "roleGaps": ["win condition", "tank", "anti-tank/air", "small spell"], "reasoning": "The selected cards (Firecracker, Bats, Skeletons, Skeleton Barrel) indicate a light bait/cycle core. To complete, Miner provides a reliable win condition and synergy with Barrel; Mega Knight adds tank and splash defense; Inferno Dragon covers heavy tanks and air; Zap offers cheap control and synergy with bait units.", "initialCards": ["Miner", "Mega Knight", "Inferno Dragon", "Zap"], "elixirAnalysis": "Average cost rises from ~2.5 to ~3.5, maintaining a mid-cycle balance suitable for Miner–Mega Knight control."}, "review": {"verificationResults": {"allCardsAvailable": true, "noDuplicates": true, "correctCount": true, "noRedundancies": true, "rolesCovered": true, "elixirReasonable": true, "synergyCheck": true}, "issuesFound": [], "reviewNotes": "All selected cards are available, unique, and synergistic. Roles are well distributed: Miner for win condition, Mega Knight for tank/splash, Inferno Dragon for anti-tank/air, Zap for control. Elixir curve is balanced."}, "refinement": {"changesMade": false, "cardsReplaced": [], "finalReasoning": "No issues found; the selection optimally complements the existing bait/cycle core. The deck achieves strong synergy, defensive stability, and offensive versatility.", "confidence": "high"}}}, "is_parsed": true, "error": null}
{"execution_id": "1cd6d8c0e9d84040bf5d7470656b7b2f", "timestamp": "2025-11-28T01:33:32.870094", "user_id": "L0092LLGP", "llm": "gpt-4o", "prompt_type": "context_multistep_english", "original_deck": ["Mega Knight", "Spear Goblins", "Bats", "Skeletons"], "deleted_cards": ["Bandit", "Skeleton Barrel", "Zap", "Firecracker"], "raw_response": "```json\n{\n  \"selection\": [\"Inferno Dragon\", \"Poison\", \"Electro Wizard\", \"Goblin Cage\"],\n  \"detail\": [\n    {\n      \"card\": \"Inferno Dragon\",\n      \"elixir_cost\": 4,\n      \"role\": \"Tank killer / air defense\",\n      \"synergiesWith\": [\"Mega Knight\", \"Bats\", \"Skeletons\"],\n      \"coversWeakness\": [\"High HP tanks\", \"Air units\"],\n      \"elixirImpact\": {\"before\": 2.5, \"after\": 3.0}\n    },\n    {\n      \"card\": \"Poison\",\n      \"elixir_cost\": 4,\n      \"role\": \"Area control / spell\",\n      \"synergiesWith\": [\"Mega Knight\", \"Skeletons\", \"Spear Goblins\"],\n      \"coversWeakness\": [\"Swarms\", \"Buildings\"],\n      \"elixirImpact\": {\"before\": 3.0, \"after\": 3.25}\n    },\n    {\n      \"card\": \"Electro Wizard\",\n      \"elixir_cost\": 4,\n      \"role\": \"Control / reset\",\n      \"synergiesWith\": [\"Mega Knight\", \"Bats\", \"Skeletons\"],\n      \"coversWeakness\": [\"Inferno units\", \"Fast attackers\"],\n      \"elixirImpact\": {\"before\": 3.25, \"after\": 3.375}\n    },\n    {\n      \"card\": \"Goblin Cage\",\n      \"elixir_cost\": 4,\n      \"role\": \"Building / tank control\",\n      \"synergiesWith\": [\"Mega Knight\", \"Spear Goblins\"],\n      \"coversWeakness\": [\"Ground win conditions\", \"Cycle decks\"],\n      \"elixirImpact\": {\"before\": 3.375, \"after\": 3.5}\n    }\n  ],\n  \"summary\": \"The deck is a control-oriented beatdown archetype centered around Mega Knight as the primary win condition, supported by versatile air and ground responses, area control, and reset capabilities.\",\n  \"n\": 4,\n  \"chainOfThought\": {\n    \"initialSelection\": {\n      \"archetypeIdentified\": \"Control-oriented beatdown\",\n      \"roleGaps\": [\"Tank killer\", \"Area control spell\", \"Reset capability\", \"Building for defense\"],\n      \"reasoning\": \"Inferno Dragon was selected to handle high HP tanks and air units, Poison for area control and synergy with swarm cards, Electro Wizard for reset and control, and Goblin Cage to provide a defensive building and tank control.\",\n      \"initialCards\": [\"Inferno Dragon\", \"Poison\", \"Electro Wizard\", \"Goblin Cage\"],\n      \"elixirAnalysis\": \"The initial selection increases the average elixir cost slightly but maintains a reasonable curve for a beatdown deck.\"\n    },\n    \"review\": {\n      \"verificationResults\": {\n        \"allCardsAvailable\": true,\n        \"noDuplicates\": true,\n        \"correctCount\": true,\n        \"noRedundancies\": true,\n        \"rolesCovered\": true,\n        \"elixirReasonable\": true,\n        \"synergyCheck\": true\n      },\n      \"issuesFound\": [],\n      \"reviewNotes\": \"The initial selection meets all constraints and effectively addresses the deck's weaknesses.\"\n    },\n    \"refinement\": {\n      \"changesMade\": false,\n      \"cardsReplaced\": [],\n      \"finalReasoning\": \"The initial selection is optimal as it balances synergy, role coverage, and elixir cost.\",\n      \"confidence\": \"high\"\n    }\n  }\n}\n```", "parsed_selection": {"selection": ["Inferno Dragon", "Poison", "Electro Wizard", "Goblin Cage"], "detail": [{"card": "Inferno Dragon", "elixir_cost": 4, "role": "Tank killer / air defense", "synergiesWith": ["Mega Knight", "Bats", "Skeletons"], "coversWeakness": ["High HP tanks", "Air units"], "elixirImpact": {"before": 2.5, "after": 3.0}}, {"card": "Poison", "elixir_cost": 4, "role": "Area control / spell", "synergiesWith": ["Mega Knight", "Skeletons", "Spear Goblins"], "coversWeakness": ["Swarms", "Buildings"], "elixirImpact": {"before": 3.0, "after": 3.25}}, {"card": "Electro Wizard", "elixir_cost": 4, "role": "Control / reset", "synergiesWith": ["Mega Knight", "Bats", "Skeletons"], "coversWeakness": ["Inferno units", "Fast attackers"], "elixirImpact": {"before": 3.25, "after": 3.375}}, {"card": "Goblin Cage", "elixir_cost": 4, "role": "Building / tank control", "synergiesWith": ["Mega Knight", "Spear Goblins"], "coversWeakness": ["Ground win conditions", "Cycle decks"], "elixirImpact": {"before": 3.375, "after": 3.5}}], "summary": "The deck is a control-oriented beatdown archetype centered around Mega Knight as the primary win condition, supported by versatile air and ground responses, area control, and reset capabilities.", "n": 4, "chainOfThought": {"initialSelection": {"archetypeIdentified": "Control-oriented beatdown", "roleGaps": ["Tank killer", "Area control spell", "Reset capability", "Building for defense"], "reasoning": "Inferno Dragon was selected to handle high HP tanks and air units, Poison for area control and synergy with swarm cards, Electro Wizard for reset and control, and Goblin Cage to provide a defensive building and tank control.", "initialCards": ["Inferno Dragon", "Poison", "Electro Wizard", "Goblin Cage"], "elixirAnalysis": "The initial selection increases the average elixir cost slightly but maintains a reasonable curve for a beatdown deck."}, "review": {"verificationResults": {"allCardsAvailable": true, "noDuplicates": true, "correctCount": true, "noRedundancies": true, "rolesCovered": true, "elixirReasonable": true, "synergyCheck": true}, "issuesFound": [], "reviewNotes": "The initial selection meets all constraints and effectively addresses the deck's weaknesses."}, "refinement": {"changesMade": false, "cardsReplaced": [], "finalReasoning": "The initial selection is optimal as it balances synergy, role coverage, and elixir cost.", "confidence": "high"}}}, "is_parsed": true, "error": null}
{"execution_id": "4edb9393c1ec4e00919d99e35c18e5c7", "timestamp": "2025-11-28T01:33:33.672899", "user_id": "VL0QCY9R8", "llm": "gpt-4o", "prompt_type": "context_multistep_english", "original_deck": ["Firecracker", "Bats", "Skeletons", "Skeleton Barrel"], "deleted_cards": ["Zap", "Mega Knight", "Bandit", "Spear Goblins"], "raw_response": "```json\n{\n  \"selection\": [\"Miner\", \"Inferno Dragon\", \"Mega Knight\", \"Zap\"],\n  \"detail\": [\n    {\n      \"card\": \"Miner\",\n      \"elixir_cost\": 3,\n      \"role\": \"Secondary win condition / chip damage\",\n      \"synergiesWith\": [\"Firecracker\", \"Bats\", \"Skeleton Barrel\"],\n      \"coversWeakness\": [\"Lack of direct tower damage\", \"Cycle pressure\"],\n      \"elixirImpact\": {\"before\": 2.5, \"after\": 2.88}\n    },\n    {\n      \"card\": \"Inferno Dragon\",\n      \"elixir_cost\": 4,\n      \"role\": \"Tank killer / air defense\",\n      \"synergiesWith\": [\"Bats\", \"Skeleton Barrel\"],\n      \"coversWeakness\": [\"Lack of tank counter\", \"Air defense\"],\n      \"elixirImpact\": {\"before\": 2.88, \"after\": 3.13}\n    },\n    {\n      \"card\": \"Mega Knight\",\n      \"elixir_cost\": 7,\n      \"role\": \"Heavy tank / splash damage\",\n      \"synergiesWith\": [\"Bats\", \"Skeleton Barrel\", \"Firecracker\"],\n      \"coversWeakness\": [\"Ground swarms\", \"Tanky threats\"],\n      \"elixirImpact\": {\"before\": 3.13, \"after\": 3.63}\n    },\n    {\n      \"card\": \"Zap\",\n      \"elixir_cost\": 2,\n      \"role\": \"Small spell / reset\",\n      \"synergiesWith\": [\"Skeleton Barrel\", \"Bats\", \"Inferno Dragon\"],\n      \"coversWeakness\": [\"Swarms\", \"Inferno Tower/Dragon reset\"],\n      \"elixirImpact\": {\"before\": 3.63, \"after\": 3.5}\n    }\n  ],\n  \"summary\": \"This deck is a bait-control archetype with Skeleton Barrel and Miner as win conditions, supported by splash damage from Firecracker and Mega Knight. It has strong air and ground defense, cycle pressure, and spell versatility.\",\n  \"n\": 4,\n  \"chainOfThought\": {\n    \"initialSelection\": {\n      \"archetypeIdentified\": \"Bait-control\",\n      \"roleGaps\": [\"Secondary win condition\", \"Tank killer\", \"Heavy splash damage\", \"Small spell\"],\n      \"reasoning\": \"Miner was chosen as a secondary win condition to complement Skeleton Barrel and provide chip damage. Inferno Dragon was added to counter tanks and support air defense. Mega Knight fills the role of a heavy tank and splash damage dealer, synergizing with the bait cards. Zap was selected as a small spell to handle swarms and reset Inferno-based defenses.\",\n      \"initialCards\": [\"Miner\", \"Inferno Dragon\", \"Mega Knight\", \"Zap\"],\n      \"elixirAnalysis\": \"The initial selection increased the average elixir cost from 2.5 to 3.5, which is reasonable for a bait-control deck.\"\n    },\n    \"review\": {\n      \"verificationResults\": {\n        \"allCardsAvailable\": true,\n        \"noDuplicates\": true,\n        \"correctCount\": true,\n        \"noRedundancies\": true,\n        \"rolesCovered\": true,\n        \"elixirReasonable\": true,\n        \"synergyCheck\": true\n      },\n      \"issuesFound\": [],\n      \"reviewNotes\": \"The initial selection meets all constraints and effectively addresses the deck's weaknesses while maintaining synergy.\"\n    },\n    \"refinement\": {\n      \"changesMade\": false,\n      \"cardsReplaced\": [],\n      \"finalReasoning\": \"The initial selection was optimal, as it filled all role gaps, maintained synergy, and kept the elixir cost reasonable for the archetype.\",\n      \"confidence\": \"high\"\n    }\n  }\n}\n```", "parsed_selection": {"selection": ["Miner", "Inferno Dragon", "Mega Knight", "Zap"], "detail": [{"card": "Miner", "elixir_cost": 3, "role": "Secondary win condition / chip damage", "synergiesWith": ["Firecracker", "Bats", "Skeleton Barrel"], "coversWeakness": ["Lack of direct tower damage", "Cycle pressure"], "elixirImpact": {"before": 2.5, "after": 2.88}}, {"card": "Inferno Dragon", "elixir_cost": 4, "role": "Tank killer / air defense", "synergiesWith": ["Bats", "Skeleton Barrel"], "coversWeakness": ["Lack of tank counter", "Air defense"], "elixirImpact": {"before": 2.88, "after": 3.13}}, {"card": "Mega Knight", "elixir_cost": 7, "role": "Heavy tank / splash damage", "synergiesWith": ["Bats", "Skeleton Barrel", "Firecracker"], "coversWeakness": ["Ground swarms", "Tanky threats"], "elixirImpact": {"before": 3.13, "after": 3.63}}, {"card": "Zap", "elixir_cost": 2, "role": "Small spell / reset", "synergiesWith": ["Skeleton Barrel", "Bats", "Inferno Dragon"], "coversWeakness": ["Swarms", "Inferno Tower/Dragon reset"], "elixirImpact": {"before": 3.63, "after": 3.5}}], "summary": "This deck is a bait-control archetype with Skeleton Barrel and Miner as win conditions, supported by splash damage from Firecracker and Mega Knight. It has strong air and ground defense, cycle pressure, and spell versatility.", "n": 4, "chainOfThought": {"initialSelection": {"archetypeIdentified": "Bait-control", "roleGaps": ["Secondary win condition", "Tank killer", "Heavy splash damage", "Small spell"], "reasoning": "Miner was chosen as a secondary win condition to complement Skeleton Barrel and provide chip damage. Inferno Dragon was added to counter tanks and support air defense. Mega Knight fills the role of a heavy tank and splash damage dealer, synergizing with the bait cards. Zap was selected as a small spell to handle swarms and reset Inferno-based defenses.", "initialCards": ["Miner", "Inferno Dragon", "Mega Knight", "Zap"], "elixirAnalysis": "The initial selection increased the average elixir cost from 2.5 to 3.5, which is reasonable for a bait-control deck."}, "review": {"verificationResults": {"allCardsAvailable": true, "noDuplicates": true, "correctCount": true, "noRedundancies": true, "rolesCovered": true, "elixirReasonable": true, "synergyCheck": true}, "issuesFound": [], "reviewNotes": "The initial selection meets all constraints and effectively addresses the deck's weaknesses while maintaining synergy."}, "refinement": {"changesMade": false, "cardsReplaced": [], "finalReasoning": "The initial selection was optimal, as it filled all role gaps, maintained synergy, and kept the elixir cost reasonable for the archetype.", "confidence": "high"}}}, "is_parsed": true, "error": null}
{"execution_id": "a56d3dc0c9434080857bcac9f98b39ff", "timestamp": "2025-11-28T01:33:36.623476", "user_id": "L0092LLGP", "llm": "gpt-35-turbo", "prompt_type": "context_multistep_english", "original_deck": ["Mega Knight", "Spear Goblins", "Bats", "Skeletons"], "deleted_cards": ["Bandit", "Skeleton Barrel", "Zap", "Firecracker"], "raw_response": "{\n  \"selection\": [\n    \"Zap\",\n    \"Fisherman\",\n    \"Poison\",\n    \"Ice Golem\"\n  ],\n  \"detail\": [\n    {\n      \"card\": \"Zap\",\n      \"elixir_cost\": \"2\",\n      \"role\": \"reset/control spell\",\n      \"synergiesWith\": [\"Mega Knight\", \"Bats\", \"Skeletons\", \"Spear Goblins\"],\n      \"coversWeakness\": [\"swarm control\", \"reset Inferno Dragon/Inferno Tower\"],\n      \"elixirImpact\": {\"before\": 3.0, \"after\": 2.75}\n    },\n    {\n      \"card\": \"Fisherman\",\n      \"elixir_cost\": \"3\",\n      \"role\": \"defense/control\",\n      \"synergiesWith\": [\"Mega Knight\", \"Skeletons\", \"Spear Goblins\"],\n      \"coversWeakness\": [\"tank pulling\", \"ground control\"],\n      \"elixirImpact\": {\"before\": 3.0, \"after\": 2.875}\n    },\n    {\n      \"card\": \"Poison\",\n      \"elixir_cost\": \"4\",\n      \"role\": \"area damage/spell\",\n      \"synergiesWith\": [\"Mega Knight\", \"Bats\", \"Skeletons\", \"Spear Goblins\"],\n      \"coversWeakness\": [\"swarm clearing\", \"building damage\"],\n      \"elixirImpact\": {\"before\": 3.0, \"after\": 3.125}\n    },\n    {\n      \"card\": \"Ice Golem\",\n      \"elixir_cost\": \"2\",\n      \"role\": \"tank/cycle\",\n      \"synergiesWith\": [\"Mega Knight\", \"Skeletons\", \"Spear Goblins\"],\n      \"coversWeakness\": [\"tank distraction\", \"cycle speed\"],\n      \"elixirImpact\": {\"before\": 3.0, \"after\": 2.875}\n    }\n  ],\n  \"summary\": \"Mega Knight beatdown/control deck with strong swarm control and reset options, balanced elixir cost, and solid ground and air defense.\",\n  \"n\": 4,\n  \"chainOfThought\": {\n    \"initialSelection\": {\n      \"archetypeIdentified\": \"Beatdown with control elements\",\n      \"roleGaps\": [\n        \"lack of reliable small spell for swarm and reset\",\n        \"need for tank distraction and cycle support\",\n        \"lack of strong area damage spell\",\n        \"need for versatile defensive control\"\n      ],\n      \"reasoning\": \"Mega Knight is the main win condition and tank. Bats, Spear Goblins, and Skeletons provide cheap air and ground swarm support. To cover weaknesses, Zap is selected for cheap reset and swarm control, Fisherman for pulling tanks and control synergy with Mega Knight, Poison for sustained area damage and building damage complementing Mega Knight's push, and Ice Golem for tank distraction and cycle speed. This combination balances elixir cost and covers key roles: win condition, control, swarm clear, and cycle.\",\n      \"initialCards\": [\"Zap\", \"Fisherman\", \"Poison\", \"Ice Golem\"],\n      \"elixirAnalysis\": \"Average elixir cost remains reasonable (~3.0) with a good balance of low and mid-cost cards to maintain tempo and support Mega Knight pushes.\"\n    },\n    \"review\": {\n      \"verificationResults\": {\n        \"allCardsAvailable\": true,\n        \"noDuplicates\": true,\n        \"correctCount\": true,\n        \"noRedundancies\": true,\n        \"rolesCovered\": true,\n        \"elixirReasonable\": true,\n        \"synergyCheck\": true\n      },\n      \"issuesFound\": [],\n      \"reviewNotes\": \"All selected cards are available and not duplicated. The deck has exactly 8 cards. Roles such as win condition, control, swarm clear, reset, and tanking are well covered. Elixir cost is balanced for a Mega Knight beatdown archetype. Synergies between Fisherman and Mega Knight, and between Poison and swarm units, are strong. No functional redundancies detected.\"\n    },\n    \"refinement\": {\n      \"changesMade\": false,\n      \"cardsReplaced\": [],\n      \"finalReasoning\": \"The initial selection is optimal given the available cards and the archetype. It balances elixir cost, covers all key roles, and maintains synergy with the selected cards.\",\n      \"confidence\": \"high\"\n    }\n  }\n}\n", "parsed_selection": {"selection": ["Zap", "Fisherman", "Poison", "Ice Golem"], "detail": [{"card": "Zap", "elixir_cost": "2", "role": "reset/control spell", "synergiesWith": ["Mega Knight", "Bats", "Skeletons", "Spear Goblins"], "coversWeakness": ["swarm control", "reset Inferno Dragon/Inferno Tower"], "elixirImpact": {"before": 3.0, "after": 2.75}}, {"card": "Fisherman", "elixir_cost": "3", "role": "defense/control", "synergiesWith": ["Mega Knight", "Skeletons", "Spear Goblins"], "coversWeakness": ["tank pulling", "ground control"], "elixirImpact": {"before": 3.0, "after": 2.875}}, {"card": "Poison", "elixir_cost": "4", "role": "area damage/spell", "synergiesWith": ["Mega Knight", "Bats", "Skeletons", "Spear Goblins"], "coversWeakness": ["swarm clearing", "building damage"], "elixirImpact": {"before": 3.0, "after": 3.125}}, {"card": "Ice Golem", "elixir_cost": "2", "role": "tank/cycle", "synergiesWith": ["Mega Knight", "Skeletons", "Spear Goblins"], "coversWeakness": ["tank distraction", "cycle speed"], "elixirImpact": {"before": 3.0, "after": 2.875}}], "summary": "Mega Knight beatdown/control deck with strong swarm control and reset options, balanced elixir cost, and solid ground and air defense.", "n": 4, "chainOfThought": {"initialSelection": {"archetypeIdentified": "Beatdown with control elements", "roleGaps": ["lack of reliable small spell for swarm and reset", "need for tank distraction and cycle support", "lack of strong area damage spell", "need for versatile defensive control"], "reasoning": "Mega Knight is the main win condition and tank. Bats, Spear Goblins, and Skeletons provide cheap air and ground swarm support. To cover weaknesses, Zap is selected for cheap reset and swarm control, Fisherman for pulling tanks and control synergy with Mega Knight, Poison for sustained area damage and building damage complementing Mega Knight's push, and Ice Golem for tank distraction and cycle speed. This combination balances elixir cost and covers key roles: win condition, control, swarm clear, and cycle.", "initialCards": ["Zap", "Fisherman", "Poison", "Ice Golem"], "elixirAnalysis": "Average elixir cost remains reasonable (~3.0) with a good balance of low and mid-cost cards to maintain tempo and support Mega Knight pushes."}, "review": {"verificationResults": {"allCardsAvailable": true, "noDuplicates": true, "correctCount": true, "noRedundancies": true, "rolesCovered": true, "elixirReasonable": true, "synergyCheck": true}, "issuesFound": [], "reviewNotes": "All selected cards are available and not duplicated. The deck has exactly 8 cards. Roles such as win condition, control, swarm clear, reset, and tanking are well covered. Elixir cost is balanced for a Mega Knight beatdown archetype. Synergies between Fisherman and Mega Knight, and between Poison and swarm units, are strong. No functional redundancies detected."}, "refinement": {"changesMade": false, "cardsReplaced": [], "finalReasoning": "The initial selection is optimal given the available cards and the archetype. It balances elixir cost, covers all key roles, and maintains synergy with the selected cards.", "confidence": "high"}}}, "is_parsed": true, "error": null}
{"execution_id": "4c429d6073014d61b176e9367c094b46", "timestamp": "2025-11-28T01:33:36.672841", "user_id": "VL0QCY9R8", "llm": "gpt-35-turbo", "prompt_type": "context_multistep_english", "original_deck": ["Firecracker", "Bats", "Skeletons", "Skeleton Barrel"], "deleted_cards": ["Zap", "Mega Knight", "Bandit", "Spear Goblins"], "raw_response": "{\n  \"selection\": [\n    \"Inferno Dragon\",\n    \"Mega Knight\",\n    \"Zap\",\n    \"Miner\"\n  ],\n  \"detail\": [\n    {\n      \"card\": \"Inferno Dragon\",\n      \"elixir_cost\": \"4\",\n      \"role\": \"win condition / tank killer\",\n      \"synergiesWith\": [\"Skeleton Barrel\", \"Bats\", \"Firecracker\"],\n      \"coversWeakness\": [\"tank threats\", \"air defense\"],\n      \"elixirImpact\": {\"before\": 2.0, \"after\": 3.5}\n    },\n    {\n      \"card\": \"Mega Knight\",\n      \"elixir_cost\": \"7\",\n      \"role\": \"tank / splash damage\",\n      \"synergiesWith\": [\"Skeleton Barrel\", \"Bats\"],\n      \"coversWeakness\": [\"ground swarm control\", \"tank presence\"],\n      \"elixirImpact\": {\"before\": 3.5, \"after\": 5.5}\n    },\n    {\n      \"card\": \"Zap\",\n      \"elixir_cost\": \"2\",\n      \"role\": \"reset / small spell\",\n      \"synergiesWith\": [\"Skeleton Barrel\", \"Bats\", \"Firecracker\"],\n      \"coversWeakness\": [\"swarm control\", \"spell\"],\n      \"elixirImpact\": {\"before\": 5.5, \"after\": 5.0}\n    },\n    {\n      \"card\": \"Miner\",\n      \"elixir_cost\": \"3\",\n      \"role\": \"chip damage / distraction\",\n      \"synergiesWith\": [\"Skeleton Barrel\", \"Firecracker\"],\n      \"coversWeakness\": [\"chip damage\", \"tank distraction\"],\n      \"elixirImpact\": {\"before\": 5.0, \"after\": 4.8}\n    }\n  ],\n  \"summary\": \"This deck is a hybrid bait/control archetype leveraging Skeleton Barrel as a primary win condition, supported by Inferno Dragon and Mega Knight for tank and splash roles, with Zap and Miner providing control, reset, and chip damage.\",\n  \"n\": 4,\n  \"chainOfThought\": {\n    \"initialSelection\": {\n      \"archetypeIdentified\": \"Bait / Control hybrid with Skeleton Barrel win condition\",\n      \"roleGaps\": [\n        \"lack of a strong tank to absorb damage\",\n        \"lack of reliable air defense and tank killer\",\n        \"absence of a small spell for swarm control and reset\",\n        \"need for chip damage and distraction\"\n      ],\n      \"reasoning\": \"Selected Inferno Dragon to handle tanks and provide air threat synergy with Skeleton Barrel and Bats. Mega Knight adds a strong tank and splash damage to control ground swarms and protect fragile units. Zap is chosen as a low-cost spell for swarm control and resetting Inferno Dragon or other units. Miner offers chip damage and distraction, synergizing well with Skeleton Barrel's pressure. These choices balance elixir cost and cover key roles missing from the initial selection.\",\n      \"initialCards\": [\"Inferno Dragon\", \"Mega Knight\", \"Zap\", \"Miner\"],\n      \"elixirAnalysis\": \"Initial average elixir cost is moderate (~4.8) which is reasonable for a bait/control deck with a strong tank presence.\"\n    },\n    \"review\": {\n      \"verificationResults\": {\n        \"allCardsAvailable\": true,\n        \"noDuplicates\": true,\n        \"correctCount\": true,\n        \"noRedundancies\": true,\n        \"rolesCovered\": true,\n        \"elixirReasonable\": true,\n        \"synergyCheck\": true\n      },\n      \"issuesFound\": [],\n      \"reviewNotes\": \"All selected cards are available and not duplicated. The deck covers win condition, tank, air and ground defense, spells, and chip damage roles without redundancy. The elixir cost is balanced for the archetype. Synergies between Skeleton Barrel, Bats, Firecracker, and the new cards are strong.\"\n    },\n    \"refinement\": {\n      \"changesMade\": false,\n      \"cardsReplaced\": [],\n      \"finalReasoning\": \"The initial selection is optimal given the available cards and the archetype. It balances roles, synergy, and elixir cost effectively.\",\n      \"confidence\": \"high\"\n    }\n  }\n}", "parsed_selection": {"selection": ["Inferno Dragon", "Mega Knight", "Zap", "Miner"], "detail": [{"card": "Inferno Dragon", "elixir_cost": "4", "role": "win condition / tank killer", "synergiesWith": ["Skeleton Barrel", "Bats", "Firecracker"], "coversWeakness": ["tank threats", "air defense"], "elixirImpact": {"before": 2.0, "after": 3.5}}, {"card": "Mega Knight", "elixir_cost": "7", "role": "tank / splash damage", "synergiesWith": ["Skeleton Barrel", "Bats"], "coversWeakness": ["ground swarm control", "tank presence"], "elixirImpact": {"before": 3.5, "after": 5.5}}, {"card": "Zap", "elixir_cost": "2", "role": "reset / small spell", "synergiesWith": ["Skeleton Barrel", "Bats", "Firecracker"], "coversWeakness": ["swarm control", "spell"], "elixirImpact": {"before": 5.5, "after": 5.0}}, {"card": "Miner", "elixir_cost": "3", "role": "chip damage / distraction", "synergiesWith": ["Skeleton Barrel", "Firecracker"], "coversWeakness": ["chip damage", "tank distraction"], "elixirImpact": {"before": 5.0, "after": 4.8}}], "summary": "This deck is a hybrid bait/control archetype leveraging Skeleton Barrel as a primary win condition, supported by Inferno Dragon and Mega Knight for tank and splash roles, with Zap and Miner providing control, reset, and chip damage.", "n": 4, "chainOfThought": {"initialSelection": {"archetypeIdentified": "Bait / Control hybrid with Skeleton Barrel win condition", "roleGaps": ["lack of a strong tank to absorb damage", "lack of reliable air defense and tank killer", "absence of a small spell for swarm control and reset", "need for chip damage and distraction"], "reasoning": "Selected Inferno Dragon to handle tanks and provide air threat synergy with Skeleton Barrel and Bats. Mega Knight adds a strong tank and splash damage to control ground swarms and protect fragile units. Zap is chosen as a low-cost spell for swarm control and resetting Inferno Dragon or other units. Miner offers chip damage and distraction, synergizing well with Skeleton Barrel's pressure. These choices balance elixir cost and cover key roles missing from the initial selection.", "initialCards": ["Inferno Dragon", "Mega Knight", "Zap", "Miner"], "elixirAnalysis": "Initial average elixir cost is moderate (~4.8) which is reasonable for a bait/control deck with a strong tank presence."}, "review": {"verificationResults": {"allCardsAvailable": true, "noDuplicates": true, "correctCount": true, "noRedundancies": true, "rolesCovered": true, "elixirReasonable": true, "synergyCheck": true}, "issuesFound": [], "reviewNotes": "All selected cards are available and not duplicated. The deck covers win condition, tank, air and ground defense, spells, and chip damage roles without redundancy. The elixir cost is balanced for the archetype. Synergies between Skeleton Barrel, Bats, Firecracker, and the new cards are strong."}, "refinement": {"changesMade": false, "cardsReplaced": [], "finalReasoning": "The initial selection is optimal given the available cards and the archetype. It balances roles, synergy, and elixir cost effectively.", "confidence": "high"}}}, "is_parsed": true, "error": null}
{"execution_id": "3f469bca05044ac5bc9a9c14f54e68cf", "timestamp": "2025-11-28T01:33:38.323314", "user_id": "VL0QCY9R8", "llm": "DeepSeek-V3.1", "prompt_type": "context_multistep_english", "original_deck": ["Firecracker", "Bats", "Skeletons", "Skeleton Barrel"], "deleted_cards": ["Zap", "Mega Knight", "Bandit", "Spear Goblins"], "raw_response": "```json\n{\n  \"selection\": [\"Miner\", \"Poison\", \"Inferno Dragon\", \"Goblin Gang\"],\n  \"detail\": [\n    {\n      \"card\": \"Miner\",\n      \"elixir_cost\": 3,\n      \"role\": \"Secondary win condition/Support\",\n      \"synergiesWith\": [\"Skeleton Barrel\", \"Bats\", \"Firecracker\"],\n      \"coversWeakness\": [\"Lack of tank killer\", \"Need for chip damage\"],\n      \"elixirImpact\": {\"before\": 2.75, \"after\": 2.88}\n    },\n    {\n      \"card\": \"Poison\",\n      \"elixir_cost\": 4,\n      \"role\": \"Large spell\",\n      \"synergiesWith\": [\"Skeleton Barrel\", \"Miner\"],\n      \"coversWeakness\": [\"Lack of area denial\", \"Need for building/area clear\"],\n      \"elixirImpact\": {\"before\": 2.88, \"after\": 3.0}\n    },\n    {\n      \"card\": \"Inferno Dragon\",\n      \"elixir_cost\": 4,\n      \"role\": \"Tank killer/Air defense\",\n      \"synergiesWith\": [\"Bats\", \"Skeleton Barrel\"],\n      \"coversWeakness\": [\"Lack of anti-tank\", \"Air defense gap\"],\n      \"elixirImpact\": {\"before\": 3.0, \"after\": 3.13}\n    },\n    {\n      \"card\": \"Goblin Gang\",\n      \"elixir_cost\": 3,\n      \"role\": \"Swarm defense/Bait\",\n      \"synergiesWith\": [\"Bats\", \"Skeletons\", \"Skeleton Barrel\"],\n      \"coversWeakness\": [\"Ground swarm defense\", \"Bait synergy\"],\n      \"elixirImpact\": {\"before\": 3.13, \"after\": 3.13}\n    }\n  ],\n  \"summary\": \"Skeleton Barrel bait deck with Miner control elements, featuring swarm units for defense and bait synergy, supported by Poison for area control and Inferno Dragon for tank killing.\",\n  \"n\": 4,\n  \"chainOfThought\": {\n    \"initialSelection\": {\n      \"archetypeIdentified\": \"Skeleton Barrel bait/control\",\n      \"roleGaps\": [\"Large spell\", \"Tank killer\", \"Secondary win condition\", \"Swarm defense\"],\n      \"reasoning\": \"The selected cards (Firecracker, Bats, Skeletons, Skeleton Barrel) suggest a bait/control archetype. Miner provides secondary win condition and synergizes with Skeleton Barrel. Poison offers area denial and building clear. Inferno Dragon covers anti-tank and air defense. Goblin Gang enhances swarm defense and bait synergy.\",\n      \"initialCards\": [\"Miner\", \"Poison\", \"Inferno Dragon\", \"Goblin Gang\"],\n      \"elixirAnalysis\": \"Average elixir increases from 2.75 to 3.13, which is reasonable for a bait/control deck with multiple low-cost cycle options.\"\n    },\n    \"review\": {\n      \"verificationResults\": {\n        \"allCardsAvailable\": true,\n        \"noDuplicates\": true,\n        \"correctCount\": true,\n        \"noRedundancies\": true,\n        \"rolesCovered\": true,\n        \"elixirReasonable\": true,\n        \"synergyCheck\": true\n      },\n      \"issuesFound\": [],\n      \"reviewNotes\": \"Initial selection covers all key roles: win condition (Skeleton Barrel + Miner), anti-air (Inferno Dragon + Bats + Firecracker), spells (Poison), swarm defense (Goblin Gang + Skeletons + Bats). Elixir cost is balanced at 3.13.\"\n    },\n    \"refinement\": {\n      \"changesMade\": false,\n      \"cardsReplaced\": [],\n      \"finalReasoning\": \"The selection optimally completes the deck with Miner for chip damage and synergy, Poison for area control, Inferno Dragon for tank killing, and Goblin Gang for enhanced swarm defense and bait mechanics. All cards are available and work well together.\",\n      \"confidence\": \"high\"\n    }\n  }\n}\n```", "parsed_selection": {"selection": ["Miner", "Poison", "Inferno Dragon", "Goblin Gang"], "detail": [{"card": "Miner", "elixir_cost": 3, "role": "Secondary win condition/Support", "synergiesWith": ["Skeleton Barrel", "Bats", "Firecracker"], "coversWeakness": ["Lack of tank killer", "Need for chip damage"], "elixirImpact": {"before": 2.75, "after": 2.88}}, {"card": "Poison", "elixir_cost": 4, "role": "Large spell", "synergiesWith": ["Skeleton Barrel", "Miner"], "coversWeakness": ["Lack of area denial", "Need for building/area clear"], "elixirImpact": {"before": 2.88, "after": 3.0}}, {"card": "Inferno Dragon", "elixir_cost": 4, "role": "Tank killer/Air defense", "synergiesWith": ["Bats", "Skeleton Barrel"], "coversWeakness": ["Lack of anti-tank", "Air defense gap"], "elixirImpact": {"before": 3.0, "after": 3.13}}, {"card": "Goblin Gang", "elixir_cost": 3, "role": "Swarm defense/Bait", "synergiesWith": ["Bats", "Skeletons", "Skeleton Barrel"], "coversWeakness": ["Ground swarm defense", "Bait synergy"], "elixirImpact": {"before": 3.13, "after": 3.13}}], "summary": "Skeleton Barrel bait deck with Miner control elements, featuring swarm units for defense and bait synergy, supported by Poison for area control and Inferno Dragon for tank killing.", "n": 4, "chainOfThought": {"initialSelection": {"archetypeIdentified": "Skeleton Barrel bait/control", "roleGaps": ["Large spell", "Tank killer", "Secondary win condition", "Swarm defense"], "reasoning": "The selected cards (Firecracker, Bats, Skeletons, Skeleton Barrel) suggest a bait/control archetype. Miner provides secondary win condition and synergizes with Skeleton Barrel. Poison offers area denial and building clear. Inferno Dragon covers anti-tank and air defense. Goblin Gang enhances swarm defense and bait synergy.", "initialCards": ["Miner", "Poison", "Inferno Dragon", "Goblin Gang"], "elixirAnalysis": "Average elixir increases from 2.75 to 3.13, which is reasonable for a bait/control deck with multiple low-cost cycle options."}, "review": {"verificationResults": {"allCardsAvailable": true, "noDuplicates": true, "correctCount": true, "noRedundancies": true, "rolesCovered": true, "elixirReasonable": true, "synergyCheck": true}, "issuesFound": [], "reviewNotes": "Initial selection covers all key roles: win condition (Skeleton Barrel + Miner), anti-air (Inferno Dragon + Bats + Firecracker), spells (Poison), swarm defense (Goblin Gang + Skeletons + Bats). Elixir cost is balanced at 3.13."}, "refinement": {"changesMade": false, "cardsReplaced": [], "finalReasoning": "The selection optimally completes the deck with Miner for chip damage and synergy, Poison for area control, Inferno Dragon for tank killing, and Goblin Gang for enhanced swarm defense and bait mechanics. All cards are available and work well together.", "confidence": "high"}}}, "is_parsed": true, "error": null}
{"execution_id": "0e4b3d73b2514c8699f2bf858a3595c6", "timestamp": "2025-11-28T01:33:39.230155", "user_id": "L0092LLGP", "llm": "DeepSeek-V3.1", "prompt_type": "context_multistep_english", "original_deck": ["Mega Knight", "Spear Goblins", "Bats", "Skeletons"], "deleted_cards": ["Bandit", "Skeleton Barrel", "Zap", "Firecracker"], "raw_response": "```json\n{\n  \"selection\": [\"Zap\", \"Miner\", \"Goblin Gang\", \"Inferno Dragon\"],\n  \"detail\": [\n    {\n      \"card\": \"Zap\",\n      \"elixir_cost\": \"2\",\n      \"role\": \"Small spell/Reset\",\n      \"synergiesWith\": [\"Mega Knight\", \"Bats\", \"Spear Goblins\"],\n      \"coversWeakness\": [\"Swarms\", \"Inferno Tower/Dragon reset\"],\n      \"elixirImpact\": {\"before\": 3.0, \"after\": 2.9}\n    },\n    {\n      \"card\": \"Miner\",\n      \"elixir_cost\": \"3\",\n      \"role\": \"Secondary win condition/Tank\",\n      \"synergiesWith\": [\"Mega Knight\", \"Bats\", \"Spear Goblins\"],\n      \"coversWeakness\": [\"Lack of reliable win condition\", \"Tower targeting\"],\n      \"elixirImpact\": {\"before\": 2.9, \"after\": 2.9}\n    },\n    {\n      \"card\": \"Goblin Gang\",\n      \"elixir_cost\": \"3\",\n      \"role\": \"Swarm defense/Bait\",\n      \"synergiesWith\": [\"Mega Knight\", \"Bats\", \"Skeletons\"],\n      \"coversWeakness\": [\"Ground defense\", \"Cycle option\"],\n      \"elixirImpact\": {\"before\": 2.9, \"after\": 2.9}\n    },\n    {\n      \"card\": \"Inferno Dragon\",\n      \"elixir_cost\": \"4\",\n      \"role\": \"Tank killer/Air defense\",\n      \"synergiesWith\": [\"Mega Knight\"],\n      \"coversWeakness\": [\"Heavy tanks\", \"Air threats\"],\n      \"elixirImpact\": {\"before\": 2.9, \"after\": 3.1}\n    }\n  ],\n  \"summary\": \"Mega Knight control deck with Miner as secondary win condition, featuring strong defensive capabilities with Inferno Dragon and swarm units, supported by Zap for reset and swarm clear.\",\n  \"n\": 4,\n  \"chainOfThought\": {\n    \"initialSelection\": {\n      \"archetypeIdentified\": \"Mega Knight Control\",\n      \"roleGaps\": [\"Win condition\", \"Anti-air\", \"Spell\", \"Tank killer\", \"Reliable defense\"],\n      \"reasoning\": \"SELECTED_CARDS has Mega Knight (tank/defense), Spear Goblins (chip/support), Bats (air defense), Skeletons (cycle/defense). Need: 1) Secondary win condition - Miner complements Mega Knight pushes and provides chip damage. 2) Anti-air/tank killer - Inferno Dragon handles tanks and air units. 3) Small spell - Zap resets infernos and clears swarms. 4) Additional swarm defense - Goblin Gang provides ground defense and bait synergy.\",\n      \"initialCards\": [\"Zap\", \"Miner\", \"Goblin Gang\", \"Inferno Dragon\"],\n      \"elixirAnalysis\": \"Initial avg: 3.0 (Mega Knight 7, Spear Goblins 2, Bats 2, Skeletons 1). Adding Zap (2), Miner (3), Goblin Gang (3), Inferno Dragon (4) = 24/8 = 3.0 avg - reasonable for control deck.\"\n    },\n    \"review\": {\n      \"verificationResults\": {\n        \"allCardsAvailable\": true,\n        \"noDuplicates\": true,\n        \"correctCount\": true,\n        \"noRedundancies\": true,\n        \"rolesCovered\": true,\n        \"elixirReasonable\": true,\n        \"synergyCheck\": true\n      },\n      \"issuesFound\": [],\n      \"reviewNotes\": \"All constraints met. Deck has win condition (Miner + Mega Knight), anti-air (Inferno Dragon + Bats), spells (Zap), swarm defense (Goblin Gang + Skeletons), and good synergy. Elixir cost balanced at 3.0.\"\n    },\n    \"refinement\": {\n      \"changesMade\": false,\n      \"cardsReplaced\": [],\n      \"finalReasoning\": \"Initial selection optimal - provides complete role coverage: Miner as secondary win condition, Inferno Dragon for tanks/air, Zap for reset/swarms, Goblin Gang for defense/bait. Strong Mega Knight control archetype with good elixir average.\",\n      \"confidence\": \"high\"\n    }\n  }\n}\n```", "parsed_selection": {"selection": ["Zap", "Miner", "Goblin Gang", "Inferno Dragon"], "detail": [{"card": "Zap", "elixir_cost": "2", "role": "Small spell/Reset", "synergiesWith": ["Mega Knight", "Bats", "Spear Goblins"], "coversWeakness": ["Swarms", "Inferno Tower/Dragon reset"], "elixirImpact": {"before": 3.0, "after": 2.9}}, {"card": "Miner", "elixir_cost": "3", "role": "Secondary win condition/Tank", "synergiesWith": ["Mega Knight", "Bats", "Spear Goblins"], "coversWeakness": ["Lack of reliable win condition", "Tower targeting"], "elixirImpact": {"before": 2.9, "after": 2.9}}, {"card": "Goblin Gang", "elixir_cost": "3", "role": "Swarm defense/Bait", "synergiesWith": ["Mega Knight", "Bats", "Skeletons"], "coversWeakness": ["Ground defense", "Cycle option"], "elixirImpact": {"before": 2.9, "after": 2.9}}, {"card": "Inferno Dragon", "elixir_cost": "4", "role": "Tank killer/Air defense", "synergiesWith": ["Mega Knight"], "coversWeakness": ["Heavy tanks", "Air threats"], "elixirImpact": {"before": 2.9, "after": 3.1}}], "summary": "Mega Knight control deck with Miner as secondary win condition, featuring strong defensive capabilities with Inferno Dragon and swarm units, supported by Zap for reset and swarm clear.", "n": 4, "chainOfThought": {"initialSelection": {"archetypeIdentified": "Mega Knight Control", "roleGaps": ["Win condition", "Anti-air", "Spell", "Tank killer", "Reliable defense"], "reasoning": "SELECTED_CARDS has Mega Knight (tank/defense), Spear Goblins (chip/support), Bats (air defense), Skeletons (cycle/defense). Need: 1) Secondary win condition - Miner complements Mega Knight pushes and provides chip damage. 2) Anti-air/tank killer - Inferno Dragon handles tanks and air units. 3) Small spell - Zap resets infernos and clears swarms. 4) Additional swarm defense - Goblin Gang provides ground defense and bait synergy.", "initialCards": ["Zap", "Miner", "Goblin Gang", "Inferno Dragon"], "elixirAnalysis": "Initial avg: 3.0 (Mega Knight 7, Spear Goblins 2, Bats 2, Skeletons 1). Adding Zap (2), Miner (3), Goblin Gang (3), Inferno Dragon (4) = 24/8 = 3.0 avg - reasonable for control deck."}, "review": {"verificationResults": {"allCardsAvailable": true, "noDuplicates": true, "correctCount": true, "noRedundancies": true, "rolesCovered": true, "elixirReasonable": true, "synergyCheck": true}, "issuesFound": [], "reviewNotes": "All constraints met. Deck has win condition (Miner + Mega Knight), anti-air (Inferno Dragon + Bats), spells (Zap), swarm defense (Goblin Gang + Skeletons), and good synergy. Elixir cost balanced at 3.0."}, "refinement": {"changesMade": false, "cardsReplaced": [], "finalReasoning": "Initial selection optimal - provides complete role coverage: Miner as secondary win condition, Inferno Dragon for tanks/air, Zap for reset/swarms, Goblin Gang for defense/bait. Strong Mega Knight control archetype with good elixir average.", "confidence": "high"}}}, "is_parsed": true, "error": null}
{"execution_id": "42b86a43868a43718cb4e6ef9461d168", "timestamp": "2025-11-28T01:33:42.682448", "user_id": "VL0QCY9R8", "llm": "Llama-3.3-70B-Instruct", "prompt_type": "context_multistep_english", "original_deck": ["Firecracker", "Bats", "Skeletons", "Skeleton Barrel"], "deleted_cards": ["Zap", "Mega Knight", "Bandit", "Spear Goblins"], "raw_response": "To complete the deck, we first need to identify the implicit archetype in the SELECTED_CARDS, which are [\"Firecracker\", \"Bats\", \"Skeletons\", \"Skeleton Barrel\"]. This combination suggests a cycle or beatdown archetype with a focus on swarming and area damage, leveraging the Skeletons and Bats for swarm potential, Firecracker for area damage, and Skeleton Barrel as a surprise element.\n\nGiven the archetype, the next step is to detect role gaps and weaknesses. The current deck lacks a strong win condition, has limited anti-air capabilities beyond Bats, and could benefit from additional area damage or spell support for reset and control.\n\nFor the initial selection, we prioritize cards that enhance the existing win condition, cover common threats, and improve synergistic matchups without inflating the average cost too much. Considering the AVAILABLE_CARDS, potential additions could include:\n\n1. **Mega Knight** - Enhances the win condition with a powerful, versatile unit that can clear swarms and push towers.\n2. **Zap** - Provides a cheap spell for reset and control, synergizing well with the Skeletons and Bats for swarm clear and surprise attacks.\n3. **Goblin Gang** - Offers additional swarm potential and can benefit from the area damage provided by Firecracker, enhancing the overall beatdown capability.\n4. **Ice Spirit** - Gives a cheap, cycling card that can help with swarm clear, provide a temporary distraction, and synergize with other units for a stronger push.\n\nThese selections aim to maintain a reasonable average elixir cost while covering key roles such as win condition, anti-air, area damage, and cycle/support.\n\n### Review and Verification\n\n- **All selected cards are within AVAILABLE_CARDS**: Yes\n- **No duplicate cards**: Yes\n- **Final deck has exactly 8 cards**: Yes, after adding the 4 selected cards.\n- **No functional redundancies without justification**: The selected cards complement the existing deck without redundancy.\n- **Roles are properly covered**: Yes, with additions for win condition, anti-air, and spell support.\n- **Elixir cost is reasonable**: Yes, the average cost remains manageable for a beatdown archetype.\n- **Better alternatives are considered**: The selected cards are optimal given the constraints and archetype.\n- **Synergy check**: The cards work well together, enhancing the deck's overall performance.\n\n### Refinement\n\nNo significant issues were found during the review that would necessitate changes to the initial selection. The cards selected enhance the deck's capabilities, cover necessary roles, and maintain a reasonable elixir cost. Thus, the initial selection is confirmed as optimal.\n\n### Output\n\n```json\n{\n  \"selection\": [\"Mega Knight\", \"Zap\", \"Goblin Gang\", \"Ice Spirit\"],\n  \"detail\": [\n    {\n      \"card\": \"Mega Knight\",\n      \"elixir_cost\": \"3\",\n      \"role\": \"Win Condition\",\n      \"synergiesWith\": [\"Skeletons\", \"Bats\"],\n      \"coversWeakness\": [\"Lack of strong win condition\"],\n      \"elixirImpact\": {\"before\": 3.5, \"after\": 3.625}\n    },\n    {\n      \"card\": \"Zap\",\n      \"elixir_cost\": \"2\",\n      \"role\": \"Spell/Reset\",\n      \"synergiesWith\": [\"Skeletons\", \"Bats\", \"Firecracker\"],\n      \"coversWeakness\": [\"Need for cheap spell\"],\n      \"elixirImpact\": {\"before\": 3.5, \"after\": 3.625}\n    },\n    {\n      \"card\": \"Goblin Gang\",\n      \"elixir_cost\": \"3\",\n      \"role\": \"Swarm/Support\",\n      \"synergiesWith\": [\"Skeletons\", \"Bats\", \"Firecracker\"],\n      \"coversWeakness\": [\"Additional swarm potential\"],\n      \"elixirImpact\": {\"before\": 3.5, \"after\": 3.625}\n    },\n    {\n      \"card\": \"Ice Spirit\",\n      \"elixir_cost\": \"1\",\n      \"role\": \"Cycle/Distraction\",\n      \"synergiesWith\": [\"Skeletons\", \"Bats\"],\n      \"coversWeakness\": [\"Need for cheap cycle\"],\n      \"elixirImpact\": {\"before\": 3.5, \"after\": 3.625}\n    }\n  ],\n  \"summary\": \"The final deck is a beatdown archetype with enhanced win conditions, improved swarm capabilities, and better spell support for resets and control.\",\n  \"n\": 4,\n  \"chainOfThought\": {\n    \"initialSelection\": {\n      \"archetypeIdentified\": \"Beatdown/Cycle\",\n      \"roleGaps\": [\"Strong win condition\", \"Anti-air\", \"Spell support\"],\n      \"reasoning\": \"Selected cards enhance the win condition, provide additional swarm potential, and offer cheap spell support for resets and control.\",\n      \"initialCards\": [\"Mega Knight\", \"Zap\", \"Goblin Gang\", \"Ice Spirit\"],\n      \"elixirAnalysis\": \"The average elixir cost remains reasonable at 3.625, allowing for flexible plays and synergies.\"\n    },\n    \"review\": {\n      \"verificationResults\": {\n        \"allCardsAvailable\": true,\n        \"noDuplicates\": true,\n        \"correctCount\": true,\n        \"noRedundancies\": true,\n        \"rolesCovered\": true,\n        \"elixirReasonable\": true,\n        \"synergyCheck\": true\n      },\n      \"issuesFound\": [],\n      \"reviewNotes\": \"The initial selection meets all constraints and enhances the deck's performance.\"\n    },\n    \"refinement\": {\n      \"changesMade\": false,\n      \"cardsReplaced\": [],\n      \"finalReasoning\": \"The selected cards are optimal for the beatdown archetype, providing a strong win condition, additional swarm potential, and necessary spell support.\",\n      \"confidence\": \"high\"\n    }\n  }\n}\n```", "parsed_selection": {"selection": ["Mega Knight", "Zap", "Goblin Gang", "Ice Spirit"], "detail": [{"card": "Mega Knight", "elixir_cost": "3", "role": "Win Condition", "synergiesWith": ["Skeletons", "Bats"], "coversWeakness": ["Lack of strong win condition"], "elixirImpact": {"before": 3.5, "after": 3.625}}, {"card": "Zap", "elixir_cost": "2", "role": "Spell/Reset", "synergiesWith": ["Skeletons", "Bats", "Firecracker"], "coversWeakness": ["Need for cheap spell"], "elixirImpact": {"before": 3.5, "after": 3.625}}, {"card": "Goblin Gang", "elixir_cost": "3", "role": "Swarm/Support", "synergiesWith": ["Skeletons", "Bats", "Firecracker"], "coversWeakness": ["Additional swarm potential"], "elixirImpact": {"before": 3.5, "after": 3.625}}, {"card": "Ice Spirit", "elixir_cost": "1", "role": "Cycle/Distraction", "synergiesWith": ["Skeletons", "Bats"], "coversWeakness": ["Need for cheap cycle"], "elixirImpact": {"before": 3.5, "after": 3.625}}], "summary": "The final deck is a beatdown archetype with enhanced win conditions, improved swarm capabilities, and better spell support for resets and control.", "n": 4, "chainOfThought": {"initialSelection": {"archetypeIdentified": "Beatdown/Cycle", "roleGaps": ["Strong win condition", "Anti-air", "Spell support"], "reasoning": "Selected cards enhance the win condition, provide additional swarm potential, and offer cheap spell support for resets and control.", "initialCards": ["Mega Knight", "Zap", "Goblin Gang", "Ice Spirit"], "elixirAnalysis": "The average elixir cost remains reasonable at 3.625, allowing for flexible plays and synergies."}, "review": {"verificationResults": {"allCardsAvailable": true, "noDuplicates": true, "correctCount": true, "noRedundancies": true, "rolesCovered": true, "elixirReasonable": true, "synergyCheck": true}, "issuesFound": [], "reviewNotes": "The initial selection meets all constraints and enhances the deck's performance."}, "refinement": {"changesMade": false, "cardsReplaced": [], "finalReasoning": "The selected cards are optimal for the beatdown archetype, providing a strong win condition, additional swarm potential, and necessary spell support.", "confidence": "high"}}}, "is_parsed": true, "error": null}
{"execution_id": "9dd598991b444a97b085c1fd3370019a", "timestamp": "2025-11-28T01:33:42.685895", "user_id": "L0092LLGP", "llm": "Llama-3.3-70B-Instruct", "prompt_type": "context_multistep_english", "original_deck": ["Mega Knight", "Spear Goblins", "Bats", "Skeletons"], "deleted_cards": ["Bandit", "Skeleton Barrel", "Zap", "Firecracker"], "raw_response": "To complete the deck with the given `SELECTED_CARDS` = [\"Mega Knight\", \"Spear Goblins\", \"Bats\", \"Skeletons\"] and `AVAILABLE_CARDS`, we will follow the steps outlined in the prompt.\n\n### Step 1: Initial Selection\nGiven the selected cards, we can identify an archetype that seems to lean towards a cycle or beatdown deck, focusing on quick deployments and swarm potential, with Mega Knight serving as a heavy hitter and potential tank. The presence of Bats and Spear Goblins indicates a desire for air and ground swarm capabilities, while Skeletons add another layer of swarm potential.\n\n- **Role Gaps and Weaknesses**: \n  - Lack of a dedicated spell for area damage or reset.\n  - Need for a more substantial ground tank or a card that can provide sustained damage.\n  - Air defense could be improved.\n\n- **Initial Selection**:\n  - **Fireball**: Provides area damage and can be used for both offense and defense, addressing the lack of a dedicated spell.\n  - **Goblin Gang**: Offers additional ground swarm potential and can help in dealing with air units, enhancing the deck's ability to handle various threats.\n  - **Ice Spirit**: Gives a cheap, versatile card for cycle potential, area damage, and can help in kiting or slowing down enemy units.\n  - **Mortar**: Acts as a win condition and can provide area damage from a distance, helping to address the need for sustained damage potential.\n\n### Step 2: Review and Verification\n- **Verification Results**:\n  - All selected cards are within `AVAILABLE_CARDS`.\n  - No duplicates are found.\n  - The final deck count will be 8, meeting the requirement.\n  - Functional redundancies are minimal and justified by their unique roles or synergies.\n  - Key roles are covered: win condition (Mega Knight, Mortar), air/ground response (Bats, Spear Goblins, Goblin Gang), area damage (Fireball, Mortar), cycle/support (Ice Spirit, Skeletons).\n  - Elixir cost is reasonable, with a mix of low to high-cost cards allowing for flexible deployment strategies.\n\n- **Issues Found**: None significant, but the deck's reliance on swarms might make it vulnerable to heavy area damage spells. However, this is somewhat mitigated by the inclusion of Ice Spirit and the potential to cycle back to key cards quickly.\n\n### Step 3: Refinement\nGiven the review, the initial selection seems to cover the necessary roles and synergies without significant issues. However, to further refine and ensure the deck's competitiveness:\n\n- **Changes Made**: None necessary based on the review, but it's worth noting that alternative cards could offer similar benefits. For example, replacing Mortar with a different win condition like Hog Rider could change the deck's dynamics, but this would also alter the archetype significantly.\n\n- **Final Reasoning**: The selected cards enhance the deck's cycle potential, provide necessary area damage, and improve both air and ground capabilities. The inclusion of a spell and a potential win condition helps to round out the deck's strategy.\n\n### Output\n```json\n{\n  \"selection\": [\"Fireball\", \"Goblin Gang\", \"Ice Spirit\", \"Mortar\"],\n  \"detail\": [\n    {\n      \"card\": \"Fireball\",\n      \"elixir_cost\": \"4\",\n      \"role\": \"Area Damage\",\n      \"synergiesWith\": [\"Mega Knight\", \"Spear Goblins\"],\n      \"coversWeakness\": [\"Lack of Area Damage\"],\n      \"elixirImpact\": {\"before\": \"Average\", \"after\": \"Still Average but with more damage potential\"}\n    },\n    {\n      \"card\": \"Goblin Gang\",\n      \"elixir_cost\": \"3\",\n      \"role\": \"Ground Swarm\",\n      \"synergiesWith\": [\"Bats\", \"Skeletons\"],\n      \"coversWeakness\": [\"Need for Additional Ground Swarm\"],\n      \"elixirImpact\": {\"before\": \"Variable\", \"after\": \"More Flexible\"}\n    },\n    {\n      \"card\": \"Ice Spirit\",\n      \"elixir_cost\": \"1\",\n      \"role\": \"Cycle and Area Damage\",\n      \"synergiesWith\": [\"Mega Knight\", \"Spear Goblins\"],\n      \"coversWeakness\": [\"Lack of Cheap Cycle Card\"],\n      \"elixirImpact\": {\"before\": \"Higher\", \"after\": \"Lower Average Cost\"}\n    },\n    {\n      \"card\": \"Mortar\",\n      \"elixir_cost\": \"4\",\n      \"role\": \"Win Condition and Area Damage\",\n      \"synergiesWith\": [\"Mega Knight\", \"Goblin Gang\"],\n      \"coversWeakness\": [\"Need for Sustained Damage Potential\"],\n      \"elixirImpact\": {\"before\": \"Variable\", \"after\": \"More Predictable\"}\n    }\n  ],\n  \"summary\": \"The deck is refined into a beatdown archetype with cycle potential, capable of handling both air and ground threats while providing sustained damage.\",\n  \"n\": 4,\n  \"chainOfThought\": {\n    \"initialSelection\": {\n      \"archetypeIdentified\": \"Beatdown/Cycle\",\n      \"roleGaps\": [\"Area Damage\", \"Ground Tank\", \"Air Defense\"],\n      \"reasoning\": \"Selected cards based on synergy with existing cards and filling role gaps.\",\n      \"initialCards\": [\"Fireball\", \"Goblin Gang\", \"Ice Spirit\", \"Mortar\"],\n      \"elixirAnalysis\": \"Mixed elixir costs to allow for flexible deployment.\"\n    },\n    \"review\": {\n      \"verificationResults\": {\n        \"allCardsAvailable\": true,\n        \"noDuplicates\": true,\n        \"correctCount\": true,\n        \"noRedundancies\": true,\n        \"rolesCovered\": true,\n        \"elixirReasonable\": true,\n        \"synergyCheck\": true\n      },\n      \"issuesFound\": [],\n      \"reviewNotes\": \"Deck seems well-rounded with the selected cards.\"\n    },\n    \"refinement\": {\n      \"changesMade\": false,\n      \"cardsReplaced\": [],\n      \"finalReasoning\": \"The deck offers a good balance of offense, defense, and cycle potential, making it competitive.\",\n      \"confidence\": \"high\"\n    }\n  }\n}\n```", "parsed_selection": {"selection": ["Fireball", "Goblin Gang", "Ice Spirit", "Mortar"], "detail": [{"card": "Fireball", "elixir_cost": "4", "role": "Area Damage", "synergiesWith": ["Mega Knight", "Spear Goblins"], "coversWeakness": ["Lack of Area Damage"], "elixirImpact": {"before": "Average", "after": "Still Average but with more damage potential"}}, {"card": "Goblin Gang", "elixir_cost": "3", "role": "Ground Swarm", "synergiesWith": ["Bats", "Skeletons"], "coversWeakness": ["Need for Additional Ground Swarm"], "elixirImpact": {"before": "Variable", "after": "More Flexible"}}, {"card": "Ice Spirit", "elixir_cost": "1", "role": "Cycle and Area Damage", "synergiesWith": ["Mega Knight", "Spear Goblins"], "coversWeakness": ["Lack of Cheap Cycle Card"], "elixirImpact": {"before": "Higher", "after": "Lower Average Cost"}}, {"card": "Mortar", "elixir_cost": "4", "role": "Win Condition and Area Damage", "synergiesWith": ["Mega Knight", "Goblin Gang"], "coversWeakness": ["Need for Sustained Damage Potential"], "elixirImpact": {"before": "Variable", "after": "More Predictable"}}], "summary": "The deck is refined into a beatdown archetype with cycle potential, capable of handling both air and ground threats while providing sustained damage.", "n": 4, "chainOfThought": {"initialSelection": {"archetypeIdentified": "Beatdown/Cycle", "roleGaps": ["Area Damage", "Ground Tank", "Air Defense"], "reasoning": "Selected cards based on synergy with existing cards and filling role gaps.", "initialCards": ["Fireball", "Goblin Gang", "Ice Spirit", "Mortar"], "elixirAnalysis": "Mixed elixir costs to allow for flexible deployment."}, "review": {"verificationResults": {"allCardsAvailable": true, "noDuplicates": true, "correctCount": true, "noRedundancies": true, "rolesCovered": true, "elixirReasonable": true, "synergyCheck": true}, "issuesFound": [], "reviewNotes": "Deck seems well-rounded with the selected cards."}, "refinement": {"changesMade": false, "cardsReplaced": [], "finalReasoning": "The deck offers a good balance of offense, defense, and cycle potential, making it competitive.", "confidence": "high"}}}, "is_parsed": true, "error": null}
